,Unnamed: 0,full_text,is_retweet,place_cord,place_name,result_type,retweet_count,screen_name,tweet_created,tweet_id,user_id,sentimental_score,sentiment_status,subjectivity,latitude,longitude
1374,1374,AND yet another repeat of a debunked story Worm squared,0,"[-83.67529, 36.540739]",Virginia,recent,0,jatoms_adams,Mon Feb 19 07:30:13 +0000 2018,9.65e+17,9.15e+17,0.0,neu,0.0,37.4316,78.6569
1376,1376,He couldn t golf all weekend to pretend he cared about 17 dead Americans so he is angry at the mean people telling him what to do,0,"[-83.67529, 36.540739]",Virginia,recent,0,FPWellman,Mon Feb 19 07:29:52 +0000 2018,9.65e+17,42518865.0,-0.3375,neg,0.695833333333,37.4316,78.6569
1379,1379,Trump is much higher in the polls just like they had Hillary winning the election Well we see how that turned out,0,"[-94.043628, 28.855128]",Louisiana,recent,0,jerry_cutrer,Mon Feb 19 07:29:26 +0000 2018,9.65e+17,9.55e+17,0.375,pos,0.625,30.9843,91.9623
1380,1380,Don t get too excited there sparky You ll be watching the show in an orange jumpsuit,0,"[-80.519851, 39.719801]",Pennsylvania,recent,0,GaillevittGail,Mon Feb 19 07:29:19 +0000 2018,9.65e+17,7.82e+17,0.375,pos,0.75,41.2033,77.1945
1381,1381,Perhaps So,0,"[-88.473228, 30.144425]",Alabama,recent,0,PerrinJule,Mon Feb 19 07:28:53 +0000 2018,9.65e+17,8.89e+17,0.0,neu,0.0,32.3182,86.9023
1391,1391,Amen,0,"[-88.473228, 30.144425]",Alabama,recent,0,PerrinJule,Mon Feb 19 07:28:08 +0000 2018,9.65e+17,8.89e+17,0.0,neu,0.0,32.3182,86.9023
1396,1396,2016 edwardmondini Paddock certainly had the rage of the Antifa Democrats amp he was clearly insane amp a man on a mission to murder as many innocent people as humanly possible I m just glad that he s dead amp in Hell now,0,"[-80.519851, 39.719801]",Pennsylvania,recent,0,WaydeDe,Mon Feb 19 07:27:27 +0000 2018,9.65e+17,48533154.0,0.0734693877551,pos,0.738775510204,41.2033,77.1945
1402,1402,Damn Chuck Still trolling this BS Many days after it s been debunked You re a worm,0,"[-83.67529, 36.540739]",Virginia,recent,0,jatoms_adams,Mon Feb 19 07:26:41 +0000 2018,9.65e+17,9.15e+17,0.5,very pos,0.5,37.4316,78.6569
1403,1403,You have no real friends asshole,0,"[-124.848975, 45.543542]",Washington,recent,0,wyattmatters,Mon Feb 19 07:26:38 +0000 2018,9.65e+17,353426101.0,0.2,pos,0.3,38.9072,77.0369
1415,1415,You know in some quarters that thumbs up hand signal is so fond of actually is an insult as in up yours https t co XMDX04WHa1,0,"[-124.703541, 41.991795]",Oregon,recent,0,cobonics,Mon Feb 19 07:23:51 +0000 2018,9.65e+17,9.04e+17,0.0,neu,0.1,43.8041,120.5542
1416,1416,President Donald Trump takes on Oprah https t co OYgjVzACLs,0,"[-106.645646, 25.837092]",Texas,recent,0,AmandaOnFOX7,Mon Feb 19 07:23:50 +0000 2018,9.65e+17,19099373.0,0.0,neu,0.0,31.9686,99.9018
